{"$defs":{"bundle_ref":{"$ref":"#/$defs/ref","properties":{"kind":{"const":"evidence_bundle"}}},"descriptor_ref":{"$ref":"#/$defs/ref","properties":{"kind":{"const":"eval_descriptor"}}},"digest":{"pattern":"^[a-f0-9]{64}$","type":"string"},"document_schema":{"additionalProperties":false,"properties":{"id":{"const":"https://agent-ops.ru/schemas/foundation_eval_result.schema.json"},"media_type":{"const":"application/schema+json"},"sha256":{"$ref":"#/$defs/digest"},"version":{"const":"1.0.0"}},"required":["id","version","sha256","media_type"],"type":"object"},"measurement":{"additionalProperties":false,"properties":{"metric":{"maxLength":128,"minLength":1,"type":"string"},"unit":{"maxLength":64,"minLength":1,"type":"string"},"value":{"maxLength":128,"minLength":1,"type":"string"}},"required":["metric","value","unit"],"type":"object"},"owner_ref":{"$ref":"#/$defs/ref","properties":{"kind":{"const":"owner"}}},"ref":{"additionalProperties":false,"properties":{"id":{"maxLength":128,"minLength":1,"type":"string"},"kind":{"enum":["owner","eval_descriptor","eval_result","evidence_bundle"]},"namespace":{"maxLength":512,"minLength":8,"type":"string"},"version":{"maxLength":32,"pattern":"^(0|[1-9][0-9]*)\\.(0|[1-9][0-9]*)\\.(0|[1-9][0-9]*)$","type":"string"}},"required":["kind","namespace","id","version"],"type":"object"},"result_ref":{"$ref":"#/$defs/ref","properties":{"kind":{"const":"eval_result"}}}},"$id":"https://agent-ops.ru/schemas/foundation_eval_result.schema.json","$schema":"https://json-schema.org/draft/2020-12/schema","additionalProperties":false,"properties":{"authority":{"enum":["authoritative_runtime_evidence","development_evidence","external_untrusted"]},"bundle_ref":{"$ref":"#/$defs/bundle_ref"},"bundle_version":{"maxLength":32,"pattern":"^(0|[1-9][0-9]*)\\.(0|[1-9][0-9]*)\\.(0|[1-9][0-9]*)$","type":"string"},"completeness":{"enum":["complete","partial","unknown"]},"descriptor_ref":{"$ref":"#/$defs/descriptor_ref"},"descriptor_sha256":{"$ref":"#/$defs/digest"},"document_schema":{"$ref":"#/$defs/document_schema"},"evaluated_at":{"format":"date-time","type":"string"},"evaluation_subject_sha256":{"$ref":"#/$defs/digest"},"fixture_sha256":{"$ref":"#/$defs/digest"},"format_version":{"const":"1.0.0"},"measurements":{"items":{"$ref":"#/$defs/measurement"},"maxItems":256,"minItems":1,"type":"array"},"outcome":{"enum":["passed","failed","not_applicable","unknown"]},"owner_ref":{"$ref":"#/$defs/owner_ref"},"ref":{"$ref":"#/$defs/result_ref"},"threshold_sha256":{"$ref":"#/$defs/digest"}},"required":["format_version","document_schema","ref","owner_ref","descriptor_ref","descriptor_sha256","bundle_ref","bundle_version","evaluation_subject_sha256","fixture_sha256","threshold_sha256","evaluated_at","measurements","completeness","authority","outcome"],"title":"Gitinsky Foundation Eval Result","type":"object"}
